{"annotationSchemaVersion":"1","annotationId":"ann.corpus.kit.abrupt-burst.v1.5afeb4a4b099","corpusId":"corpus.kit.abrupt-burst.v1.5afeb4a4b099","scenarioId":"kit.abrupt-burst.v1","annotations":[{"eventId":"evt-b330aec7-0001","scenarioId":"kit.abrupt-burst.v1","expectedClass":"benign","category":"warmup"},{"eventId":"evt-b330aec7-0002","scenarioId":"kit.abrupt-burst.v1","expectedClass":"benign","category":"warmup"},{"eventId":"evt-b330aec7-0003","scenarioId":"kit.abrupt-burst.v1","expectedClass":"benign","category":"warmup"},{"eventId":"evt-b330aec7-0004","scenarioId":"kit.abrupt-burst.v1","expectedClass":"benign","category":"warmup"},{"eventId":"evt-b330aec7-0005","scenarioId":"kit.abrupt-burst.v1","expectedClass":"benign","category":"evaluation-normal"},{"eventId":"evt-b330aec7-0006","scenarioId":"kit.abrupt-burst.v1","expectedClass":"benign","category":"evaluation-normal"},{"eventId":"evt-b330aec7-0007","scenarioId":"kit.abrupt-burst.v1","expectedClass":"anomalous","category":"burst"},{"eventId":"evt-b330aec7-0008","scenarioId":"kit.abrupt-burst.v1","expectedClass":"anomalous","category":"burst"},{"eventId":"evt-b330aec7-0009","scenarioId":"kit.abrupt-burst.v1","expectedClass":"anomalous","category":"burst"},{"eventId":"evt-b330aec7-0010","scenarioId":"kit.abrupt-burst.v1","expectedClass":"anomalous","category":"burst"}],"notes":"Sidecar only. Join by eventId at evaluation time. Never embed in EvaluationEvent."}
