{"annotationSchemaVersion":"1","annotationId":"ann.corpus.kit.recovery.v1.bb526d92cce4","corpusId":"corpus.kit.recovery.v1.bb526d92cce4","scenarioId":"kit.recovery.v1","annotations":[{"eventId":"evt-383c61d5-0001","scenarioId":"kit.recovery.v1","expectedClass":"benign","category":"warmup"},{"eventId":"evt-383c61d5-0002","scenarioId":"kit.recovery.v1","expectedClass":"benign","category":"warmup"},{"eventId":"evt-383c61d5-0003","scenarioId":"kit.recovery.v1","expectedClass":"benign","category":"warmup"},{"eventId":"evt-383c61d5-0004","scenarioId":"kit.recovery.v1","expectedClass":"benign","category":"warmup"},{"eventId":"evt-383c61d5-0005","scenarioId":"kit.recovery.v1","expectedClass":"benign","category":"evaluation-normal"},{"eventId":"evt-383c61d5-0006","scenarioId":"kit.recovery.v1","expectedClass":"anomalous","category":"burst"},{"eventId":"evt-383c61d5-0007","scenarioId":"kit.recovery.v1","expectedClass":"anomalous","category":"burst"},{"eventId":"evt-383c61d5-0008","scenarioId":"kit.recovery.v1","expectedClass":"anomalous","category":"burst"},{"eventId":"evt-383c61d5-0009","scenarioId":"kit.recovery.v1","expectedClass":"benign","category":"recovery"},{"eventId":"evt-383c61d5-0010","scenarioId":"kit.recovery.v1","expectedClass":"benign","category":"recovery"}],"notes":"Sidecar only. Join by eventId at evaluation time. Never embed in EvaluationEvent."}
