{"annotationSchemaVersion":"1","annotationId":"ann.corpus.kit.established-normal.v1.dffe70ac8547","corpusId":"corpus.kit.established-normal.v1.dffe70ac8547","scenarioId":"kit.established-normal.v1","annotations":[{"eventId":"evt-cd3d4738-0001","scenarioId":"kit.established-normal.v1","expectedClass":"benign","category":"warmup"},{"eventId":"evt-cd3d4738-0002","scenarioId":"kit.established-normal.v1","expectedClass":"benign","category":"warmup"},{"eventId":"evt-cd3d4738-0003","scenarioId":"kit.established-normal.v1","expectedClass":"benign","category":"warmup"},{"eventId":"evt-cd3d4738-0004","scenarioId":"kit.established-normal.v1","expectedClass":"benign","category":"warmup"},{"eventId":"evt-cd3d4738-0005","scenarioId":"kit.established-normal.v1","expectedClass":"benign","category":"evaluation-normal"},{"eventId":"evt-cd3d4738-0006","scenarioId":"kit.established-normal.v1","expectedClass":"benign","category":"evaluation-normal"},{"eventId":"evt-cd3d4738-0007","scenarioId":"kit.established-normal.v1","expectedClass":"benign","category":"evaluation-normal"},{"eventId":"evt-cd3d4738-0008","scenarioId":"kit.established-normal.v1","expectedClass":"benign","category":"evaluation-normal"},{"eventId":"evt-cd3d4738-0009","scenarioId":"kit.established-normal.v1","expectedClass":"benign","category":"evaluation-normal"},{"eventId":"evt-cd3d4738-0010","scenarioId":"kit.established-normal.v1","expectedClass":"benign","category":"evaluation-normal"}],"notes":"Sidecar only. Join by eventId at evaluation time. Never embed in EvaluationEvent."}
