{"annotationSchemaVersion":"1","annotationId":"ann.corpus.kit.warmup-cold-start.v1.ae11e2a00307","corpusId":"corpus.kit.warmup-cold-start.v1.ae11e2a00307","scenarioId":"kit.warmup-cold-start.v1","annotations":[{"eventId":"evt-546ff75a-0001","scenarioId":"kit.warmup-cold-start.v1","expectedClass":"benign","category":"warmup"},{"eventId":"evt-546ff75a-0002","scenarioId":"kit.warmup-cold-start.v1","expectedClass":"benign","category":"cold-start"},{"eventId":"evt-546ff75a-0003","scenarioId":"kit.warmup-cold-start.v1","expectedClass":"benign","category":"cold-start"},{"eventId":"evt-546ff75a-0004","scenarioId":"kit.warmup-cold-start.v1","expectedClass":"benign","category":"evaluation-normal"},{"eventId":"evt-546ff75a-0005","scenarioId":"kit.warmup-cold-start.v1","expectedClass":"benign","category":"evaluation-normal"},{"eventId":"evt-546ff75a-0006","scenarioId":"kit.warmup-cold-start.v1","expectedClass":"benign","category":"evaluation-normal"},{"eventId":"evt-546ff75a-0007","scenarioId":"kit.warmup-cold-start.v1","expectedClass":"benign","category":"evaluation-normal"}],"notes":"Sidecar only. Join by eventId at evaluation time. Never embed in EvaluationEvent."}
