{"annotationSchemaVersion":"1","annotationId":"ann.corpus.kit.endpoint-distribution-change.v1.4f4b67c6aead","corpusId":"corpus.kit.endpoint-distribution-change.v1.4f4b67c6aead","scenarioId":"kit.endpoint-distribution-change.v1","annotations":[{"eventId":"evt-3fad0e9c-0001","scenarioId":"kit.endpoint-distribution-change.v1","expectedClass":"benign","category":"warmup"},{"eventId":"evt-3fad0e9c-0002","scenarioId":"kit.endpoint-distribution-change.v1","expectedClass":"benign","category":"warmup"},{"eventId":"evt-3fad0e9c-0003","scenarioId":"kit.endpoint-distribution-change.v1","expectedClass":"benign","category":"warmup"},{"eventId":"evt-3fad0e9c-0004","scenarioId":"kit.endpoint-distribution-change.v1","expectedClass":"benign","category":"warmup"},{"eventId":"evt-3fad0e9c-0005","scenarioId":"kit.endpoint-distribution-change.v1","expectedClass":"benign","category":"evaluation-normal"},{"eventId":"evt-3fad0e9c-0006","scenarioId":"kit.endpoint-distribution-change.v1","expectedClass":"benign","category":"evaluation-normal"},{"eventId":"evt-3fad0e9c-0007","scenarioId":"kit.endpoint-distribution-change.v1","expectedClass":"anomalous","category":"endpoint-distribution-change"},{"eventId":"evt-3fad0e9c-0008","scenarioId":"kit.endpoint-distribution-change.v1","expectedClass":"anomalous","category":"endpoint-distribution-change"},{"eventId":"evt-3fad0e9c-0009","scenarioId":"kit.endpoint-distribution-change.v1","expectedClass":"anomalous","category":"endpoint-distribution-change"},{"eventId":"evt-3fad0e9c-0010","scenarioId":"kit.endpoint-distribution-change.v1","expectedClass":"anomalous","category":"endpoint-distribution-change"}],"notes":"Sidecar only. Join by eventId at evaluation time. Never embed in EvaluationEvent."}
