{"annotationSchemaVersion":"1","annotationId":"ann.corpus.kit.identity-session-transition.v1.c6e02b593f8d","corpusId":"corpus.kit.identity-session-transition.v1.c6e02b593f8d","scenarioId":"kit.identity-session-transition.v1","annotations":[{"eventId":"evt-62b924e1-0001","scenarioId":"kit.identity-session-transition.v1","expectedClass":"benign","category":"warmup"},{"eventId":"evt-62b924e1-0002","scenarioId":"kit.identity-session-transition.v1","expectedClass":"benign","category":"warmup"},{"eventId":"evt-62b924e1-0003","scenarioId":"kit.identity-session-transition.v1","expectedClass":"benign","category":"warmup"},{"eventId":"evt-62b924e1-0004","scenarioId":"kit.identity-session-transition.v1","expectedClass":"benign","category":"warmup"},{"eventId":"evt-62b924e1-0005","scenarioId":"kit.identity-session-transition.v1","expectedClass":"benign","category":"evaluation-normal"},{"eventId":"evt-62b924e1-0006","scenarioId":"kit.identity-session-transition.v1","expectedClass":"benign","category":"evaluation-normal"},{"eventId":"evt-62b924e1-0007","scenarioId":"kit.identity-session-transition.v1","expectedClass":"anomalous","category":"identity-session-transition"},{"eventId":"evt-62b924e1-0008","scenarioId":"kit.identity-session-transition.v1","expectedClass":"anomalous","category":"identity-session-transition"},{"eventId":"evt-62b924e1-0009","scenarioId":"kit.identity-session-transition.v1","expectedClass":"anomalous","category":"identity-session-transition"},{"eventId":"evt-62b924e1-0010","scenarioId":"kit.identity-session-transition.v1","expectedClass":"anomalous","category":"identity-session-transition"}],"notes":"Sidecar only. Join by eventId at evaluation time. Never embed in EvaluationEvent."}
