{"annotationSchemaVersion":"1","annotationId":"ann.corpus.kit.multi-feature-anomaly.v1.5f5f77f02747","corpusId":"corpus.kit.multi-feature-anomaly.v1.5f5f77f02747","scenarioId":"kit.multi-feature-anomaly.v1","annotations":[{"eventId":"evt-075a2c65-0001","scenarioId":"kit.multi-feature-anomaly.v1","expectedClass":"benign","category":"warmup"},{"eventId":"evt-075a2c65-0002","scenarioId":"kit.multi-feature-anomaly.v1","expectedClass":"benign","category":"warmup"},{"eventId":"evt-075a2c65-0003","scenarioId":"kit.multi-feature-anomaly.v1","expectedClass":"benign","category":"warmup"},{"eventId":"evt-075a2c65-0004","scenarioId":"kit.multi-feature-anomaly.v1","expectedClass":"benign","category":"warmup"},{"eventId":"evt-075a2c65-0005","scenarioId":"kit.multi-feature-anomaly.v1","expectedClass":"benign","category":"evaluation-normal"},{"eventId":"evt-075a2c65-0006","scenarioId":"kit.multi-feature-anomaly.v1","expectedClass":"benign","category":"evaluation-normal"},{"eventId":"evt-075a2c65-0007","scenarioId":"kit.multi-feature-anomaly.v1","expectedClass":"anomalous","category":"multi-feature-anomaly"},{"eventId":"evt-075a2c65-0008","scenarioId":"kit.multi-feature-anomaly.v1","expectedClass":"anomalous","category":"multi-feature-anomaly"},{"eventId":"evt-075a2c65-0009","scenarioId":"kit.multi-feature-anomaly.v1","expectedClass":"anomalous","category":"multi-feature-anomaly"},{"eventId":"evt-075a2c65-0010","scenarioId":"kit.multi-feature-anomaly.v1","expectedClass":"anomalous","category":"multi-feature-anomaly"}],"notes":"Sidecar only. Join by eventId at evaluation time. Never embed in EvaluationEvent."}
