{"annotationSchemaVersion":"1","annotationId":"ann.corpus.northgate.abrupt-burst.v1.87421db9ade8","corpusId":"corpus.northgate.abrupt-burst.v1.87421db9ade8","scenarioId":"northgate.abrupt-burst.v1","annotations":[{"eventId":"evt-a11fd21f-0001","scenarioId":"northgate.abrupt-burst.v1","expectedClass":"benign","category":"warmup"},{"eventId":"evt-a11fd21f-0002","scenarioId":"northgate.abrupt-burst.v1","expectedClass":"benign","category":"warmup"},{"eventId":"evt-a11fd21f-0003","scenarioId":"northgate.abrupt-burst.v1","expectedClass":"benign","category":"warmup"},{"eventId":"evt-a11fd21f-0004","scenarioId":"northgate.abrupt-burst.v1","expectedClass":"benign","category":"warmup"},{"eventId":"evt-a11fd21f-0005","scenarioId":"northgate.abrupt-burst.v1","expectedClass":"benign","category":"warmup"},{"eventId":"evt-a11fd21f-0006","scenarioId":"northgate.abrupt-burst.v1","expectedClass":"benign","category":"warmup"},{"eventId":"evt-a11fd21f-0007","scenarioId":"northgate.abrupt-burst.v1","expectedClass":"benign","category":"warmup"},{"eventId":"evt-a11fd21f-0008","scenarioId":"northgate.abrupt-burst.v1","expectedClass":"benign","category":"warmup"},{"eventId":"evt-a11fd21f-0009","scenarioId":"northgate.abrupt-burst.v1","expectedClass":"benign","category":"warmup"},{"eventId":"evt-a11fd21f-0010","scenarioId":"northgate.abrupt-burst.v1","expectedClass":"benign","category":"warmup"},{"eventId":"evt-a11fd21f-0011","scenarioId":"northgate.abrupt-burst.v1","expectedClass":"benign","category":"warmup"},{"eventId":"evt-a11fd21f-0012","scenarioId":"northgate.abrupt-burst.v1","expectedClass":"benign","category":"warmup"},{"eventId":"evt-a11fd21f-0013","scenarioId":"northgate.abrupt-burst.v1","expectedClass":"benign","category":"warmup"},{"eventId":"evt-a11fd21f-0014","scenarioId":"northgate.abrupt-burst.v1","expectedClass":"benign","category":"warmup"},{"eventId":"evt-a11fd21f-0015","scenarioId":"northgate.abrupt-burst.v1","expectedClass":"benign","category":"warmup"},{"eventId":"evt-a11fd21f-0016","scenarioId":"northgate.abrupt-burst.v1","expectedClass":"benign","category":"warmup"},{"eventId":"evt-a11fd21f-0017","scenarioId":"northgate.abrupt-burst.v1","expectedClass":"benign","category":"warmup"},{"eventId":"evt-a11fd21f-0018","scenarioId":"northgate.abrupt-burst.v1","expectedClass":"benign","category":"warmup"},{"eventId":"evt-a11fd21f-0019","scenarioId":"northgate.abrupt-burst.v1","expectedClass":"benign","category":"warmup"},{"eventId":"evt-a11fd21f-0020","scenarioId":"northgate.abrupt-burst.v1","expectedClass":"benign","category":"warmup"},{"eventId":"evt-a11fd21f-0021","scenarioId":"northgate.abrupt-burst.v1","expectedClass":"benign","category":"warmup"},{"eventId":"evt-a11fd21f-0022","scenarioId":"northgate.abrupt-burst.v1","expectedClass":"benign","category":"warmup"},{"eventId":"evt-a11fd21f-0023","scenarioId":"northgate.abrupt-burst.v1","expectedClass":"benign","category":"warmup"},{"eventId":"evt-a11fd21f-0024","scenarioId":"northgate.abrupt-burst.v1","expectedClass":"benign","category":"warmup"},{"eventId":"evt-a11fd21f-0025","scenarioId":"northgate.abrupt-burst.v1","expectedClass":"benign","category":"warmup"},{"eventId":"evt-a11fd21f-0026","scenarioId":"northgate.abrupt-burst.v1","expectedClass":"benign","category":"warmup"},{"eventId":"evt-a11fd21f-0027","scenarioId":"northgate.abrupt-burst.v1","expectedClass":"benign","category":"warmup"},{"eventId":"evt-a11fd21f-0028","scenarioId":"northgate.abrupt-burst.v1","expectedClass":"benign","category":"warmup"},{"eventId":"evt-a11fd21f-0029","scenarioId":"northgate.abrupt-burst.v1","expectedClass":"benign","category":"warmup"},{"eventId":"evt-a11fd21f-0030","scenarioId":"northgate.abrupt-burst.v1","expectedClass":"benign","category":"warmup"},{"eventId":"evt-a11fd21f-0031","scenarioId":"northgate.abrupt-burst.v1","expectedClass":"benign","category":"warmup"},{"eventId":"evt-a11fd21f-0032","scenarioId":"northgate.abrupt-burst.v1","expectedClass":"benign","category":"warmup"},{"eventId":"evt-a11fd21f-0033","scenarioId":"northgate.abrupt-burst.v1","expectedClass":"benign","category":"warmup"},{"eventId":"evt-a11fd21f-0034","scenarioId":"northgate.abrupt-burst.v1","expectedClass":"benign","category":"warmup"},{"eventId":"evt-a11fd21f-0035","scenarioId":"northgate.abrupt-burst.v1","expectedClass":"benign","category":"warmup"},{"eventId":"evt-a11fd21f-0036","scenarioId":"northgate.abrupt-burst.v1","expectedClass":"benign","category":"warmup"},{"eventId":"evt-a11fd21f-0037","scenarioId":"northgate.abrupt-burst.v1","expectedClass":"benign","category":"warmup"},{"eventId":"evt-a11fd21f-0038","scenarioId":"northgate.abrupt-burst.v1","expectedClass":"benign","category":"warmup"},{"eventId":"evt-a11fd21f-0039","scenarioId":"northgate.abrupt-burst.v1","expectedClass":"benign","category":"warmup"},{"eventId":"evt-a11fd21f-0040","scenarioId":"northgate.abrupt-burst.v1","expectedClass":"benign","category":"warmup"},{"eventId":"evt-a11fd21f-0041","scenarioId":"northgate.abrupt-burst.v1","expectedClass":"benign","category":"warmup"},{"eventId":"evt-a11fd21f-0042","scenarioId":"northgate.abrupt-burst.v1","expectedClass":"benign","category":"warmup"},{"eventId":"evt-a11fd21f-0043","scenarioId":"northgate.abrupt-burst.v1","expectedClass":"benign","category":"warmup"},{"eventId":"evt-a11fd21f-0044","scenarioId":"northgate.abrupt-burst.v1","expectedClass":"benign","category":"warmup"},{"eventId":"evt-a11fd21f-0045","scenarioId":"northgate.abrupt-burst.v1","expectedClass":"benign","category":"warmup"},{"eventId":"evt-a11fd21f-0046","scenarioId":"northgate.abrupt-burst.v1","expectedClass":"benign","category":"warmup"},{"eventId":"evt-a11fd21f-0047","scenarioId":"northgate.abrupt-burst.v1","expectedClass":"benign","category":"warmup"},{"eventId":"evt-a11fd21f-0048","scenarioId":"northgate.abrupt-burst.v1","expectedClass":"benign","category":"warmup"},{"eventId":"evt-a11fd21f-0049","scenarioId":"northgate.abrupt-burst.v1","expectedClass":"benign","category":"evaluation-normal"},{"eventId":"evt-a11fd21f-0050","scenarioId":"northgate.abrupt-burst.v1","expectedClass":"benign","category":"evaluation-normal"},{"eventId":"evt-a11fd21f-0051","scenarioId":"northgate.abrupt-burst.v1","expectedClass":"benign","category":"evaluation-normal"},{"eventId":"evt-a11fd21f-0052","scenarioId":"northgate.abrupt-burst.v1","expectedClass":"benign","category":"evaluation-normal"},{"eventId":"evt-a11fd21f-0053","scenarioId":"northgate.abrupt-burst.v1","expectedClass":"benign","category":"evaluation-normal"},{"eventId":"evt-a11fd21f-0054","scenarioId":"northgate.abrupt-burst.v1","expectedClass":"benign","category":"evaluation-normal"},{"eventId":"evt-a11fd21f-0055","scenarioId":"northgate.abrupt-burst.v1","expectedClass":"benign","category":"evaluation-normal"},{"eventId":"evt-a11fd21f-0056","scenarioId":"northgate.abrupt-burst.v1","expectedClass":"benign","category":"evaluation-normal"},{"eventId":"evt-a11fd21f-0057","scenarioId":"northgate.abrupt-burst.v1","expectedClass":"benign","category":"evaluation-normal"},{"eventId":"evt-a11fd21f-0058","scenarioId":"northgate.abrupt-burst.v1","expectedClass":"benign","category":"evaluation-normal"},{"eventId":"evt-a11fd21f-0059","scenarioId":"northgate.abrupt-burst.v1","expectedClass":"benign","category":"evaluation-normal"},{"eventId":"evt-a11fd21f-0060","scenarioId":"northgate.abrupt-burst.v1","expectedClass":"benign","category":"evaluation-normal"},{"eventId":"evt-a11fd21f-0061","scenarioId":"northgate.abrupt-burst.v1","expectedClass":"anomalous","category":"burst"},{"eventId":"evt-a11fd21f-0062","scenarioId":"northgate.abrupt-burst.v1","expectedClass":"anomalous","category":"burst"},{"eventId":"evt-a11fd21f-0063","scenarioId":"northgate.abrupt-burst.v1","expectedClass":"anomalous","category":"burst"},{"eventId":"evt-a11fd21f-0064","scenarioId":"northgate.abrupt-burst.v1","expectedClass":"anomalous","category":"burst"},{"eventId":"evt-a11fd21f-0065","scenarioId":"northgate.abrupt-burst.v1","expectedClass":"anomalous","category":"burst"},{"eventId":"evt-a11fd21f-0066","scenarioId":"northgate.abrupt-burst.v1","expectedClass":"anomalous","category":"burst"},{"eventId":"evt-a11fd21f-0067","scenarioId":"northgate.abrupt-burst.v1","expectedClass":"anomalous","category":"burst"},{"eventId":"evt-a11fd21f-0068","scenarioId":"northgate.abrupt-burst.v1","expectedClass":"anomalous","category":"burst"},{"eventId":"evt-a11fd21f-0069","scenarioId":"northgate.abrupt-burst.v1","expectedClass":"anomalous","category":"burst"},{"eventId":"evt-a11fd21f-0070","scenarioId":"northgate.abrupt-burst.v1","expectedClass":"anomalous","category":"burst"},{"eventId":"evt-a11fd21f-0071","scenarioId":"northgate.abrupt-burst.v1","expectedClass":"anomalous","category":"burst"},{"eventId":"evt-a11fd21f-0072","scenarioId":"northgate.abrupt-burst.v1","expectedClass":"anomalous","category":"burst"},{"eventId":"evt-a11fd21f-0073","scenarioId":"northgate.abrupt-burst.v1","expectedClass":"anomalous","category":"burst"},{"eventId":"evt-a11fd21f-0074","scenarioId":"northgate.abrupt-burst.v1","expectedClass":"anomalous","category":"burst"},{"eventId":"evt-a11fd21f-0075","scenarioId":"northgate.abrupt-burst.v1","expectedClass":"anomalous","category":"burst"},{"eventId":"evt-a11fd21f-0076","scenarioId":"northgate.abrupt-burst.v1","expectedClass":"anomalous","category":"burst"},{"eventId":"evt-a11fd21f-0077","scenarioId":"northgate.abrupt-burst.v1","expectedClass":"anomalous","category":"burst"},{"eventId":"evt-a11fd21f-0078","scenarioId":"northgate.abrupt-burst.v1","expectedClass":"anomalous","category":"burst"},{"eventId":"evt-a11fd21f-0079","scenarioId":"northgate.abrupt-burst.v1","expectedClass":"anomalous","category":"burst"},{"eventId":"evt-a11fd21f-0080","scenarioId":"northgate.abrupt-burst.v1","expectedClass":"anomalous","category":"burst"}],"notes":"Sidecar only. Join by eventId at evaluation time. Never embed in EvaluationEvent."}
