{"annotationSchemaVersion":"1","annotationId":"ann.corpus.kit.low-variance-deviation.v1.eb2737ee8b17","corpusId":"corpus.kit.low-variance-deviation.v1.eb2737ee8b17","scenarioId":"kit.low-variance-deviation.v1","annotations":[{"eventId":"evt-2eaafea1-0001","scenarioId":"kit.low-variance-deviation.v1","expectedClass":"benign","category":"warmup"},{"eventId":"evt-2eaafea1-0002","scenarioId":"kit.low-variance-deviation.v1","expectedClass":"benign","category":"warmup"},{"eventId":"evt-2eaafea1-0003","scenarioId":"kit.low-variance-deviation.v1","expectedClass":"benign","category":"warmup"},{"eventId":"evt-2eaafea1-0004","scenarioId":"kit.low-variance-deviation.v1","expectedClass":"benign","category":"warmup"},{"eventId":"evt-2eaafea1-0005","scenarioId":"kit.low-variance-deviation.v1","expectedClass":"benign","category":"evaluation-normal"},{"eventId":"evt-2eaafea1-0006","scenarioId":"kit.low-variance-deviation.v1","expectedClass":"benign","category":"evaluation-normal"},{"eventId":"evt-2eaafea1-0007","scenarioId":"kit.low-variance-deviation.v1","expectedClass":"anomalous","category":"low-variance-deviation"},{"eventId":"evt-2eaafea1-0008","scenarioId":"kit.low-variance-deviation.v1","expectedClass":"anomalous","category":"low-variance-deviation"},{"eventId":"evt-2eaafea1-0009","scenarioId":"kit.low-variance-deviation.v1","expectedClass":"anomalous","category":"low-variance-deviation"},{"eventId":"evt-2eaafea1-0010","scenarioId":"kit.low-variance-deviation.v1","expectedClass":"anomalous","category":"low-variance-deviation"}],"notes":"Sidecar only. Join by eventId at evaluation time. Never embed in EvaluationEvent."}
