{"annotationSchemaVersion":"1","annotationId":"ann.corpus.kit.legitimate-burst.v1.b2bf7088fe26","corpusId":"corpus.kit.legitimate-burst.v1.b2bf7088fe26","scenarioId":"kit.legitimate-burst.v1","annotations":[{"eventId":"evt-809364bf-0001","scenarioId":"kit.legitimate-burst.v1","expectedClass":"benign","category":"warmup"},{"eventId":"evt-809364bf-0002","scenarioId":"kit.legitimate-burst.v1","expectedClass":"benign","category":"warmup"},{"eventId":"evt-809364bf-0003","scenarioId":"kit.legitimate-burst.v1","expectedClass":"benign","category":"warmup"},{"eventId":"evt-809364bf-0004","scenarioId":"kit.legitimate-burst.v1","expectedClass":"benign","category":"warmup"},{"eventId":"evt-809364bf-0005","scenarioId":"kit.legitimate-burst.v1","expectedClass":"benign","category":"evaluation-normal"},{"eventId":"evt-809364bf-0006","scenarioId":"kit.legitimate-burst.v1","expectedClass":"benign","category":"evaluation-normal"},{"eventId":"evt-809364bf-0007","scenarioId":"kit.legitimate-burst.v1","expectedClass":"benign","category":"legitimate-burst"},{"eventId":"evt-809364bf-0008","scenarioId":"kit.legitimate-burst.v1","expectedClass":"benign","category":"legitimate-burst"},{"eventId":"evt-809364bf-0009","scenarioId":"kit.legitimate-burst.v1","expectedClass":"benign","category":"legitimate-burst"},{"eventId":"evt-809364bf-0010","scenarioId":"kit.legitimate-burst.v1","expectedClass":"benign","category":"legitimate-burst"}],"notes":"Sidecar only. Join by eventId at evaluation time. Never embed in EvaluationEvent."}
