{"annotationSchemaVersion":"1","annotationId":"ann.corpus.kit.gradual-drift.v1.8919ea58c9f2","corpusId":"corpus.kit.gradual-drift.v1.8919ea58c9f2","scenarioId":"kit.gradual-drift.v1","annotations":[{"eventId":"evt-f10d0aec-0001","scenarioId":"kit.gradual-drift.v1","expectedClass":"benign","category":"warmup"},{"eventId":"evt-f10d0aec-0002","scenarioId":"kit.gradual-drift.v1","expectedClass":"benign","category":"warmup"},{"eventId":"evt-f10d0aec-0003","scenarioId":"kit.gradual-drift.v1","expectedClass":"benign","category":"warmup"},{"eventId":"evt-f10d0aec-0004","scenarioId":"kit.gradual-drift.v1","expectedClass":"benign","category":"warmup"},{"eventId":"evt-f10d0aec-0005","scenarioId":"kit.gradual-drift.v1","expectedClass":"anomalous","category":"gradual-drift"},{"eventId":"evt-f10d0aec-0006","scenarioId":"kit.gradual-drift.v1","expectedClass":"anomalous","category":"gradual-drift"},{"eventId":"evt-f10d0aec-0007","scenarioId":"kit.gradual-drift.v1","expectedClass":"anomalous","category":"gradual-drift"},{"eventId":"evt-f10d0aec-0008","scenarioId":"kit.gradual-drift.v1","expectedClass":"anomalous","category":"gradual-drift"},{"eventId":"evt-f10d0aec-0009","scenarioId":"kit.gradual-drift.v1","expectedClass":"anomalous","category":"gradual-drift"},{"eventId":"evt-f10d0aec-0010","scenarioId":"kit.gradual-drift.v1","expectedClass":"anomalous","category":"gradual-drift"}],"notes":"Sidecar only. Join by eventId at evaluation time. Never embed in EvaluationEvent."}
